{
  "schema_version": "excel_complex_scenarios.v1",
  "version": "v1.0.0",
  "defaults": {
    "approve": true,
    "seed_profile": "sales_core",
    "sheet_name": "매출"
  },
  "scenarios": [
    {
      "id": "complex-001-sort-followup-desc",
      "title": "정렬 멀티턴 슬롯 채움(내림차순)",
      "category": "sort",
      "difficulty": "hard",
      "severity": "critical",
      "turns": [
        { "message": "정렬해줘" },
        { "message": "금액 열 기준 내림차순으로 정렬해줘" }
      ],
      "oracle": {
        "conversation": {
          "turn_expectations": [
            {
              "turn_index": 0,
              "status_code": 200,
              "action_in": ["excel_live.sort", "excel_live.clarify"],
              "ask_follow_up": true
            },
            {
              "turn_index": 1,
              "status_code": 200,
              "action": "excel_live.sort_range"
            }
          ]
        },
        "execution": {
          "must_include_actions": ["excel_live.sort_range"],
          "forbid_actions": ["excel_live.clear_range"]
        },
        "result": {
          "assertions": [
            { "type": "cell_equals", "sheet": "매출", "cell": "E2", "expected": 1440 }
          ]
        }
      }
    },
    {
      "id": "complex-002-sort-direct-asc",
      "title": "정렬 직접 지시(오름차순)",
      "category": "sort",
      "difficulty": "hard",
      "severity": "critical",
      "turns": [
        { "message": "매출 시트 A1:H9 범위를 금액 열 기준 오름차순 정렬해줘" }
      ],
      "oracle": {
        "conversation": {
          "turn_expectations": [
            { "turn_index": 0, "status_code": 200, "action": "excel_live.sort_range" }
          ]
        },
        "execution": {
          "must_include_actions": ["excel_live.sort_range"]
        },
        "result": {
          "assertions": [
            { "type": "cell_equals", "sheet": "매출", "cell": "E2", "expected": 840 }
          ]
        }
      }
    },
    {
      "id": "complex-003-filter-status-complete",
      "title": "상태 기준 필터(완료)",
      "category": "filter",
      "difficulty": "hard",
      "severity": "critical",
      "turns": [
        { "message": "완료된 건만 보여줘" }
      ],
      "oracle": {
        "conversation": {
          "turn_expectations": [
            {
              "turn_index": 0,
              "status_code": 200,
              "action": "excel_live.filter_rows",
              "result_numeric_gte": { "filtered_rows": 1 }
            }
          ]
        },
        "execution": {
          "must_include_actions": ["excel_live.filter_rows"]
        },
        "result": { "assertions": [] }
      }
    },
    {
      "id": "complex-004-filter-followup-amount",
      "title": "금액 조건 필터 멀티턴",
      "category": "filter",
      "difficulty": "hard",
      "severity": "critical",
      "turns": [
        { "message": "조건에 맞는 것만 보여줘" },
        { "message": "금액이 1000 이상인 행만 남겨줘" }
      ],
      "oracle": {
        "conversation": {
          "turn_expectations": [
            {
              "turn_index": 0,
              "status_code": 200,
              "action_in": ["excel_live.filter", "excel_live.clarify"],
              "ask_follow_up": true
            },
            {
              "turn_index": 1,
              "status_code": 200,
              "action": "excel_live.filter_rows",
              "result_numeric_gte": { "filtered_rows": 1 }
            }
          ]
        },
        "execution": {
          "must_include_actions": ["excel_live.filter_rows"]
        },
        "result": { "assertions": [] }
      }
    },
    {
      "id": "complex-005-dedupe-direct-code",
      "title": "코드 기준 중복 제거",
      "category": "dedupe",
      "difficulty": "hard",
      "severity": "critical",
      "turns": [
        { "message": "코드 열 기준으로 중복 제거해줘" }
      ],
      "oracle": {
        "conversation": {
          "turn_expectations": [
            {
              "turn_index": 0,
              "status_code": 200,
              "action": "excel_live.dedupe_rows",
              "result_numeric_gte": { "removed_rows": 1 }
            }
          ]
        },
        "execution": {
          "must_include_actions": ["excel_live.dedupe_rows"]
        },
        "result": { "assertions": [] }
      }
    },
    {
      "id": "complex-006-dedupe-followup",
      "title": "중복 제거 멀티턴 슬롯 채움",
      "category": "dedupe",
      "difficulty": "hard",
      "severity": "critical",
      "turns": [
        { "message": "중복 없애줘" },
        { "message": "코드 기준으로 정리해줘" }
      ],
      "oracle": {
        "conversation": {
          "turn_expectations": [
            {
              "turn_index": 0,
              "status_code": 200,
              "action_in": ["excel_live.dedupe", "excel_live.clarify"],
              "ask_follow_up": true
            },
            {
              "turn_index": 1,
              "status_code": 200,
              "action": "excel_live.dedupe_rows",
              "result_numeric_gte": { "removed_rows": 1 }
            }
          ]
        },
        "execution": {
          "must_include_actions": ["excel_live.dedupe_rows"]
        },
        "result": { "assertions": [] }
      }
    },
    {
      "id": "complex-007-create-table-singleturn-values",
      "title": "표 생성 + 내용 채우기 단일턴",
      "category": "table",
      "difficulty": "hard",
      "severity": "critical",
      "turns": [
        {
          "message": "B2부터 3행 3열 표 만들고 헤더는 항목,수량,금액으로 채워줘"
        }
      ],
      "oracle": {
        "conversation": {
          "turn_expectations": [
            {
              "turn_index": 0,
              "status_code": 200,
              "action_in": ["excel_live.write_range", "excel_live.create_table"]
            }
          ]
        },
        "execution": {
          "must_include_actions": ["excel_live.create_table"],
          "forbid_actions": ["excel_live.clear_range"]
        },
        "result": {
          "assertions": [
            {
              "type": "range_non_empty_at_least",
              "sheet": "매출",
              "range": "B2:D2",
              "min_count": 3
            }
          ]
        }
      }
    },
    {
      "id": "complex-008-create-table-template-followup",
      "title": "템플릿 표 생성 멀티턴",
      "category": "table",
      "difficulty": "hard",
      "severity": "critical",
      "turns": [
        { "message": "회의록 표 만들어줘" },
        { "message": "6행 5열로 날짜,참석자,안건,결정사항,담당자 헤더 넣어줘" }
      ],
      "oracle": {
        "conversation": {
          "turn_expectations": [
            {
              "turn_index": 0,
              "status_code": 200,
              "action": "excel_live.create_table",
              "ask_follow_up": true
            },
            {
              "turn_index": 1,
              "status_code": 200,
              "action_in": ["excel_live.write_range", "excel_live.create_table"]
            }
          ]
        },
        "execution": {
          "must_include_actions": ["excel_live.create_table"]
        },
        "result": {
          "assertions": [
            {
              "type": "range_non_empty_at_least",
              "sheet": "매출",
              "range": "A1:E1",
              "min_count": 5
            }
          ]
        }
      }
    },
    {
      "id": "complex-009-formula-multiply-followup",
      "title": "곱셈 수식 멀티턴 + 결과 검증",
      "category": "formula",
      "difficulty": "hard",
      "severity": "critical",
      "turns": [
        { "message": "수량이랑 단가 곱해서 금액 계산해줘" },
        { "message": "수량은 C열, 단가는 D열, 결과는 E열이야" }
      ],
      "oracle": {
        "conversation": {
          "turn_expectations": [
            {
              "turn_index": 0,
              "status_code": 200,
              "action_in": ["excel_live.formula", "excel_live.clarify"],
              "ask_follow_up": true
            },
            {
              "turn_index": 1,
              "status_code": 200,
              "action_in": ["excel_live.verify_formula_result", "excel_live.set_formula"],
              "result_numeric_gte": { "numeric_cells": 1 }
            }
          ]
        },
        "execution": {
          "must_include_actions": ["excel_live.set_formula"],
          "forbid_actions": ["excel_live.clear_range"]
        },
        "result": {
          "assertions": [
            {
              "type": "cell_formula_startswith",
              "sheet": "매출",
              "cell": "E2",
              "prefix": "=C2*D2"
            }
          ]
        }
      }
    },
    {
      "id": "complex-010-formula-if-followup",
      "title": "조건 수식(IF) 멀티턴",
      "category": "formula",
      "difficulty": "hard",
      "severity": "critical",
      "sheet_name": "평가",
      "turns": [
        { "message": "점수 기준으로 합격/불합격 나오게 해줘" },
        { "message": "점수는 B열이고 70 미만이면 미달, 아니면 통과야" }
      ],
      "oracle": {
        "conversation": {
          "turn_expectations": [
            {
              "turn_index": 0,
              "status_code": 200,
              "action_in": ["excel_live.formula", "excel_live.clarify"],
              "ask_follow_up": true
            },
            {
              "turn_index": 1,
              "status_code": 200,
              "action_in": ["excel_live.verify_formula_result", "excel_live.set_formula"]
            }
          ]
        },
        "execution": {
          "must_include_actions": ["excel_live.set_formula"]
        },
        "result": {
          "assertions": [
            {
              "type": "cell_formula_startswith",
              "sheet": "평가",
              "cell": "C2",
              "prefix": "=IF("
            }
          ]
        }
      }
    },
    {
      "id": "complex-011-formula-vlookup-followup",
      "title": "조회 수식(VLOOKUP/XLOOKUP) 멀티턴",
      "category": "formula",
      "difficulty": "very-hard",
      "severity": "critical",
      "sheet_name": "주문",
      "turns": [
        { "message": "코드 기준으로 단가 찾아와" },
        { "message": "조회값은 A열, 참조표는 조회표 시트 A:B, 반환 2열, 결과는 B열이야" }
      ],